{
  "id": "LESSON-CANOPY-LST-002",
  "title": "Low-Stress Training, Trellising and SCROG Principles",
  "version": "1.2.0",
  "status": "draft",
  "competencies": [
    "COMP-CANOPY-001"
  ],
  "learningObjectives": [
    "LO-CANOPY-LST-002"
  ],
  "estimatedMinutes": 40,
  "references": [
    "REF-CANOPY-001",
    "REF-LIGHT-001"
  ],
  "assessment": null,
  "content": {
    "overview": "Low-stress training reshapes plant architecture by positioning shoots rather than intentionally removing large amounts of tissue. Bending, tying, trellising, and screen-based training can redistribute dominance, improve access, and manage canopy height when applied gradually.",
    "vocabulary": [
      {
        "term": "Low-stress training",
        "definition": "Canopy manipulation that bends or positions shoots without deliberately causing major tissue damage."
      },
      {
        "term": "Trellis",
        "definition": "A support structure used to position and support branches or shoots."
      },
      {
        "term": "SCROG",
        "definition": "Screen-of-green training in which shoots are distributed through or beneath a support screen to shape the canopy."
      },
      {
        "term": "Apical dominance",
        "definition": "Relative suppression of lateral growth by a dominant shoot apex."
      }
    ],
    "sections": [
      {
        "title": "Bending changes shoot position and dominance",
        "body": "Repositioning the main shoot can reduce its vertical advantage and allow lateral branches to contribute more strongly to canopy development.",
        "references": [
          "REF-CANOPY-001"
        ]
      },
      {
        "title": "Support structures create spatial control",
        "body": "Trellises and screens can separate branches, maintain target height, and support reproductive weight. They also influence access for inspection, irrigation, and pruning.",
        "references": [
          "REF-CANOPY-001"
        ]
      },
      {
        "title": "Training should respond to growth",
        "body": "Plants continue changing after shoots are positioned. Repeated small adjustments are usually more controllable than forcing a mature rigid stem into a large bend at once.",
        "references": [
          "REF-CANOPY-001"
        ]
      },
      {
        "title": "Uniform structure still requires measurement",
        "body": "A visually flat canopy can still contain large light-intensity differences. Training outcomes should be checked with crop-level light and microclimate observations.",
        "references": [
          "REF-CANOPY-001"
        ]
      }
    ],
    "workedExamples": [
      "If one leader grows far above neighboring branches, gradual bending and support can redistribute height without removing the apex.",
      "If a screen is overcrowded, adding more shoots may worsen shading; evaluate spacing rather than treating every empty opening as a target.",
      "A grower fills every trellis opening early, then finds overlapping branches and shaded interior growth later. The learner recognizes that screen occupancy is a spacing problem, not a goal to maximize.",
      "After repositioning dominant shoots, canopy height becomes more even but PPFD still varies widely. The learner verifies fixture distribution and leaf overlap instead of assuming LST solved the whole light problem."
    ],
    "commonMistakes": [
      "Making severe bends in rigid mature tissue.",
      "Packing too many shoots into a screen.",
      "Assuming a flat canopy automatically has uniform PPFD.",
      "Overtightening ties so stems are constricted as they thicken.",
      "Training without preserving access for scouting, irrigation and sanitation."
    ],
    "practicalApplication": "Define the desired canopy footprint and height, position vigorous shoots gradually, secure them without girdling stems, maintain inspection access, and verify the resulting light distribution and airflow.",
    "summary": "Low-stress training uses positioning and support to shape architecture with relatively low tissue injury. Effective use depends on gradual adjustment, spacing, plant vigor, and measured canopy conditions.",
    "blocks": [
      {
        "type": "text",
        "title": "LST changes geometry without removing the main source tissue",
        "body": "Bending and positioning alter shoot angle, height and local dominance while preserving most leaf and stem tissue. The value comes from redistributing architecture with relatively low recovery cost.",
        "references": [
          "REF-CANOPY-001"
        ]
      },
      {
        "type": "table",
        "title": "LST decisions should solve a measurable problem",
        "columns": [
          "Problem",
          "Possible low-stress response",
          "Verification"
        ],
        "rows": [
          [
            "One leader too tall",
            "Bend/reposition/support",
            "Height spread + PPFD map"
          ],
          [
            "Uneven branch spacing",
            "Trellis redistribution",
            "Branch spacing/access"
          ],
          [
            "Interior crowding",
            "Selective repositioning",
            "Airflow/scouting access"
          ],
          [
            "Weak branch support",
            "Trellis/support",
            "Mechanical stability"
          ],
          [
            "Shading at edges",
            "Reposition + spacing review",
            "Before/after light map"
          ]
        ],
        "references": [
          "REF-CANOPY-001"
        ]
      },
      {
        "type": "steps",
        "title": "Train gradually",
        "items": [
          {
            "title": "Define the target shape",
            "body": "Set desired height, footprint and access."
          },
          {
            "title": "Select flexible tissue",
            "body": "Avoid forcing mature rigid stems."
          },
          {
            "title": "Apply small adjustments",
            "body": "Reposition over time rather than in one severe bend."
          },
          {
            "title": "Secure without constriction",
            "body": "Allow stem expansion."
          },
          {
            "title": "Reassess growth",
            "body": "Plants continue changing after each adjustment."
          },
          {
            "title": "Verify with measurements",
            "body": "Check PPFD, access and microclimate rather than appearance alone."
          }
        ]
      },
      {
        "type": "scenario",
        "title": "The screen is full, but the canopy is worse",
        "setting": "Nearly every trellis opening contains a shoot, but branches overlap and interior leaves remain shaded.",
        "prompt": "What is the best interpretation?",
        "options": [
          "More filled openings always means better SCROG",
          "Shoot density is too high for the available space",
          "Add more ties only",
          "The trellis is irrelevant"
        ],
        "answer": "Shoot density is too high for the available space.",
        "feedback": "SCROG is a spacing and distribution system, not a contest to occupy every opening."
      },
      {
        "type": "activity",
        "title": "Plan an LST intervention",
        "instructions": "Use a canopy diagram with four dominant shoots and several shaded laterals.",
        "prompts": [
          "Choose which shoots to reposition.",
          "Show target branch locations.",
          "Identify any access problems created by the plan.",
          "State what PPFD or geometry measurement will verify success."
        ],
        "artifact": "LST canopy plan"
      },
      {
        "type": "callout",
        "title": "Key takeaway",
        "tone": "evidence",
        "body": "Low-stress training works when it improves measured canopy geometry and access with minimal recovery cost."
      }
    ],
    "extensions": {
      "primaryVisuals": [
        {
          "type": "image",
          "assetId": "VIS-FOUNDATION-LST-001",
          "title": "Low-stress training",
          "src": "/assets/course5/foundation-lst-before-after.webp",
          "alt": "Before-and-after canopy diagram comparing a dominant upright plant with gradually repositioned branches distributed across a trellis for more even spacing and scouting access.",
          "caption": "Low-stress training redistributes branches gradually. Protect plant vigor, sanitation, airflow and access, then verify the canopy response.",
          "references": [
            "REF-CANOPY-001",
            "REF-LIGHT-001"
          ],
          "extensions": {
            "conceptId": "VIS-FOUNDATION-LST-001",
            "releaseApproved": true,
            "releaseState": "owner-approved-production-release",
            "rasterManifest": "visuals/COURSE5-ASSET-REGISTRY.json"
          }
        }
      ]
    }
  }
}
