{
  "id": "LESSON-HYDRO-SYSTEMS-001",
  "title": "Hydroponic Systems: Recirculating, Drain-to-Waste and Water Movement",
  "version": "1.0.0",
  "status": "approved",
  "competencies": [
    "COMP-HYDRO-ADV-001"
  ],
  "learningObjectives": [
    "LO-HYDRO-SYSTEMS-001"
  ],
  "estimatedMinutes": 45,
  "references": [
    "REF-ROOTZONE-NUTRIENT-002"
  ],
  "assessment": null,
  "content": {
    "overview": "Hydroponic systems differ mainly in how roots receive water, nutrients and oxygen and whether drainage is reused. System choice changes monitoring, sanitation, nutrient accumulation and failure risks rather than changing the basic biological needs of roots.",
    "vocabulary": [
      {
        "term": "Recirculating system",
        "definition": "A system that captures and reuses nutrient solution after it passes through or around the root zone."
      },
      {
        "term": "Drain-to-waste",
        "definition": "A system in which applied nutrient solution is not routinely returned to the feed reservoir."
      },
      {
        "term": "Reservoir turnover",
        "definition": "Replacement or renewal of nutrient solution in a storage reservoir over time."
      }
    ],
    "sections": [
      {
        "title": "Recirculation increases feedback",
        "body": "Reused solution reflects both the original formulation and what plants, evaporation and the root zone have changed. Monitoring therefore becomes part of maintaining solution quality rather than a one-time mixing task.",
        "references": [
          "REF-ROOTZONE-NUTRIENT-002"
        ]
      },
      {
        "title": "Drain-to-waste separates feed from drainage",
        "body": "Fresh feed can be more predictable, but drainage volume, environmental impact and root-zone accumulation still need management. Discarding solution does not eliminate the need to monitor what remains around the roots.",
        "references": [
          "REF-ROOTZONE-NUTRIENT-002"
        ]
      },
      {
        "title": "Failure modes differ",
        "body": "Pump failure, blocked emitters, reservoir contamination, temperature problems and uneven flow can affect hydroponic systems quickly. Redundancy and observation should match the system's dependence on continuous water movement.",
        "references": [
          "REF-ROOTZONE-NUTRIENT-002"
        ]
      }
    ],
    "workedExamples": [
      "A recirculating reservoir that starts at the target EC can drift as plants selectively remove water and ions; measure the trend instead of assuming the starting mix remains unchanged.",
      "In a drip system, one blocked emitter can create a local root-zone failure even when reservoir readings look normal."
    ],
    "commonMistakes": [
      "Treating all hydroponic systems as the same.",
      "Monitoring only the reservoir and not delivery uniformity.",
      "Assuming drainage disposal prevents root-zone salt accumulation."
    ],
    "practicalApplication": "Document system type, reservoir volume, flow path, return/drainage handling, pump/emitter checks and pH/EC trends. Identify which failures could interrupt water or oxygen delivery and define a response before they occur.",
    "summary": "Hydroponics is controlled root-zone delivery. Recirculation, drainage, monitoring and system reliability determine how stable that delivery remains."
  }
}
