{"id":"LESSON-THC-C032-004","title":"Climbing, Positioning, and Working From Ladders","version":"1.0.0","status":"draft","competencies":["COMP-SAFETY-WORK-001"],"learningObjectives":["LO-SAFETY-LADDER-004"],"estimatedMinutes":35,"references":["REF-OSHA-1910-23-LADDERS"],"content":{"overview":"Safe climbing depends on body control, contact with the ladder, load management, and a willingness to reposition instead of overreach. OSHA requires workers to face the ladder while climbing and to use at least one hand to grasp it when ascending and descending. It also prohibits carrying objects or loads that could cause a loss of balance. These rules must be translated into realistic work planning for sensors, trellis, irrigation lines, filters, crop supports, and routine inspection tasks.","vocabulary":[{"term":"Center of balance","definition":"The body position relative to the ladder and support area that affects whether the worker remains stable or begins to tip or overreach."},{"term":"Overreach","definition":"Extending the body beyond a stable working position instead of descending and repositioning the access equipment."},{"term":"Contact strategy","definition":"A planned way to maintain stable hand, foot, and body contact while climbing and performing the task."}],"sections":[{"title":"Climb deliberately","body":"Face the ladder during ascent and descent, keep hands available for secure contact, and keep footwear and steps free of substances that reduce traction. Plan tools and materials before climbing: use an approved method for staging, hoisting, or carrying small items that does not compromise balance or required hand contact. Do not climb with an awkward tote, coil, tray, or tool bundle that makes the worker twist or prevents safe control.","references":["REF-OSHA-1910-23-LADDERS"]},{"title":"Work inside a stable position","body":"The worker should be able to perform the task without leaning far to one side, standing on prohibited surfaces, or applying force that destabilizes the ladder. OSHA prohibits using the top step or cap of a stepladder as a step. If the task moves beyond a controlled reach zone, descend and reposition. Repeated repositioning may also indicate that a platform or different method is more appropriate than a ladder for the job.","references":["REF-OSHA-1910-23-LADDERS"]},{"title":"Separate task pressure from safety decisions","body":"Production pressure can make unsafe shortcuts feel temporary: one extra reach, one last clip, one heavy object carried up, or one step higher than intended. Build the stopping point into the job plan. The worker should be able to say, before climbing, what load, reach, duration, floor change, or interference requires descent and reset. Supervisors should reward this correction behavior rather than treating repositioning as lost time.","references":["REF-OSHA-1910-23-LADDERS"]}],"workedExamples":["A technician can reach three sensors from a stable position but the fourth requires leaning past the rail. The correct method is to descend and reposition before inspecting the fourth sensor.","A worker needs a drill and a box of hardware at height. Instead of climbing while carrying both, the task is staged so the climb remains controlled and the materials are supplied without compromising balance."],"commonMistakes":["Treating three points of contact as a slogan while carrying a load that makes controlled climbing impossible.","Using the top step or cap of a stepladder as a work position.","Finishing an overreaching task because only a few seconds remain."],"practicalApplication":"Demonstrate a safe ascent, work-position decision, and descent on a simulated ladder task. Include a staged tool/material plan and intentionally identify a target that requires descending and repositioning instead of reaching farther.","summary":"Controlled ladder use combines correct climbing, manageable loads, stable work positioning, and timely repositioning. The goal is not to stay on the ladder longer; it is to complete the task without trading production speed for balance."}}